{
  "@context": "https://cheeleong.dev/troika-system-json/context.jsonld",
  "@id": "https://cheeleong.dev/troika-system-json/objects/backgrounds/66-zoanthrop.json",
  "@type": "Background",
  "id": 66,
  "name": "Zoanthrop",
  "description": "At some point in your past you decided you didn't need it anymore: you found a Zoanthropologist and paid them well to remove your troublesome forebrain and elevate you to the pure and unburdened beast you are today.",
  "possessions": [],
  "advancedSkills": [
    {
      "name": "Climb",
      "rank": 3
    },
    {
      "name": "Run",
      "rank": 3
    },
    {
      "name": "Strength",
      "rank": 2
    },
    {
      "name": "Fist Fighting",
      "rank": 2
    },
    {
      "name": "Club Fighting",
      "rank": 2
    },
    {
      "name": "Wrestling",
      "rank": 2
    }
  ],
  "spells": [],
  "special": [
    "You are immune to all mind altering effects. You are able to speak but usually choose not to. When making Advancement Checks for Skills related to abstract thought, such as Spells or Astrology, you must roll twice and succeed on both to improve them."
  ]
}
