{
  "@context": "https://troika-system-json.cheeleong.dev/context.jsonld",
  "@id": "https://troika-system-json.cheeleong.dev/objects/backgrounds/22-dwarf.json",
  "@type": "Background",
  "id": 22,
  "name": "Dwarf",
  "description": "You are a short, hairy, belligerent, alcohol dependent creature. Dwarfs are a sculpted people, ungendered, and thus there are no Dwarf children or Dwarf families to prevent you from fully committing to the important Dwarfy endeavours of creating fine art in unusual places. You intend to find the most unusual places in all the million spheres.",
  "possessions": [
    {
      "name": "Masonry Hammer",
      "description": "Heavy hammer for stonework"
    },
    {
      "name": "Roll of Artist's Supplies",
      "description": "Materials for artistic creation"
    }
  ],
  "advancedSkills": [
    {
      "name": "Awareness",
      "rank": 3
    },
    {
      "name": "Sculpting",
      "rank": 2
    },
    {
      "name": "Painting",
      "rank": 2
    },
    {
      "name": "Metalworking",
      "rank": 2
    },
    {
      "name": "Construction",
      "rank": 2
    },
    {
      "name": "Strength",
      "rank": 2
    },
    {
      "name": "Fist Fighting",
      "rank": 2
    },
    {
      "name": "Wrestling",
      "rank": 2
    },
    {
      "name": "Hammer Fighting",
      "rank": 1
    }
  ],
  "spells": [],
  "special": [
    "Dwarfs may eat gems and rare metals as food replacements. You, in fact, vastly prefer the taste of rare minerals to mundane food."
  ]
}
