{
  "@context": "https://troika-system-json.cheeleong.dev/context.jsonld",
  "@id": "https://troika-system-json.cheeleong.dev/objects/backgrounds/52-academy-of-doors.json",
  "@type": "Background",
  "id": 52,
  "name": "Sorcerer of the Academy of Doors",
  "description": "You are a student at Troika's most prestigious wizarding academy (pride of the city, experts in pan-dimensional mobility) you were finally able to penetrate the (2d6)th door. You are no master but few outside your peers can claim to know more about the vagaries of skyward travel than you.",
  "possessions": [
    {
      "name": "Small Functional Door worn on your forehead through which you channel your magic"
    },
    {
      "name": "Flashy Robes"
    }
  ],
  "advancedSkills": [
    {
      "name": "Astrology",
      "rank": 3
    },
    {
      "name": "Second Sight",
      "rank": 2
    }
  ],
  "spells": [
    {
      "name": "Astral Reach",
      "rank": 2
    },
    {
      "name": "Teleport",
      "rank": 1
    },
    {
      "name": "Web",
      "rank": 1
    },
    {
      "name": "Random",
      "rank": 1
    },
    {
      "name": "Random",
      "rank": 1
    },
    {
      "name": "Random",
      "rank": 1
    }
  ],
  "special": []
}
