{
  "@context": "https://cheeleong.dev/troika-system-json/systems/context.jsonld",
  "@id": "https://cheeleong.dev/troika-system-json/objects/backgrounds/15-chaos-champion.json",
  "@type": "Background",
  "id": 15,
  "name": "Chaos Champion",
  "description": "You no longer don the spiked brass armour but you still have the ear of your Chaos patron. They're happy for you to experiment with not plunging your world into disorder and, ultimately, darkness, but the door is always open.",
  "possessions": [
    {
      "name": "Ritual Scars",
      "description": "Ceremonial markings from your service"
    },
    {
      "name": "Huge Maul",
      "description": "Massive two-handed weapon"
    },
    {
      "name": "Assortment of Ragged Armour",
      "description": "Counts as Modest Armour"
    },
    {
      "name": "Dream Journal",
      "description": "Almost full with visions from your patron"
    }
  ],
  "advancedSkills": [
    {
      "name": "Language \u2013 Kurgan",
      "rank": 6
    },
    {
      "name": "Maul Fighting",
      "rank": 3
    },
    {
      "name": "Secret Signs \u2013 Chaos Patron",
      "rank": 3
    },
    {
      "name": "Second Sight",
      "rank": 1
    }
  ],
  "spells": [
    {
      "name": "Random",
      "rank": 1
    }
  ],
  "special": [
    "Name your patron. You may call upon your patron for aid once per day. To do so roll three 6s on 3d6. The GM interprets their intervention."
  ]
}
