{
  "@context": "https://troika-system-json.cheeleong.dev/context.jsonld",
  "@id": "https://troika-system-json.cheeleong.dev/objects/backgrounds/14-cacogen.json",
  "@type": "Background",
  "id": 14,
  "name": "Cacogen",
  "description": "You are Those-Filthy-Born, spawned in the hump-backed sky lit only by great black anti-suns and false light. Your mother was sailing on the golden barges or caught in some more abstract fate when she passed you, far from the protective malaise of the million spheres. You were receptive to the power and the glory at a generative time and it shows in your teratoid form.",
  "possessions": [
    {
      "name": "Fusil",
      "description": "Energy weapon"
    },
    {
      "name": "2d6 Plasmic Cores",
      "description": "Energy source for weapons"
    },
    {
      "name": "Sword",
      "description": "Melee weapon"
    },
    {
      "name": "Velare",
      "description": "Hard-light disguise device"
    }
  ],
  "advancedSkills": [
    {
      "name": "Fusil Fighting",
      "rank": 2
    },
    {
      "name": "Astrology",
      "rank": 2
    },
    {
      "name": "Second Sight",
      "rank": 2
    },
    {
      "name": "Golden Barge Pilot",
      "rank": 2
    },
    {
      "name": "Sword Fighting",
      "rank": 1
    }
  ],
  "spells": [
    {
      "name": "Random",
      "rank": 2
    },
    {
      "name": "Random",
      "rank": 2
    },
    {
      "name": "Random",
      "rank": 1
    }
  ],
  "special": []
}
