{
  "@context": "https://cheeleong.dev/troika-system-json/systems/context.jsonld",
  "@id": "https://cheeleong.dev/troika-system-json/objects/backgrounds/54-beef-steaks.json",
  "@type": "Background",
  "id": 54,
  "name": "Fellow of The Sublime Society of Beef Steaks",
  "description": "Brawlers believe the application of might and a good beef steak is the universal truth. Words have no power and can no more define the universe than they can build a house, lift a cup, or sear a steak. Might can! Really, they have thought a lot about this.",
  "possessions": [
    {
      "name": "Weapon of your choice"
    },
    {
      "name": "Small Gridiron"
    },
    {
      "name": "2kg of Premium Meat Cuts"
    },
    {
      "name": "Waistcoat"
    },
    {
      "name": "Bottle of Strong but Fancy Wine"
    }
  ],
  "advancedSkills": [
    {
      "name": "Fighting in chosen weapon",
      "rank": 2
    },
    {
      "name": "Wrestling",
      "rank": 2
    },
    {
      "name": "Swim",
      "rank": 2
    },
    {
      "name": "Climb",
      "rank": 2
    },
    {
      "name": "Run",
      "rank": 2
    },
    {
      "name": "Fist Fighting",
      "rank": 2
    },
    {
      "name": "Grilling",
      "rank": 1
    }
  ],
  "spells": [],
  "special": []
}
