{
  "@context": "https://cheeleong.dev/troika-system-json/systems/context.jsonld",
  "@id": "https://cheeleong.dev/troika-system-json/objects/backgrounds/61-thinking-engine.json",
  "@type": "Background",
  "id": 61,
  "name": "Thinking Engine",
  "description": "Your eyes are dull ruby spheres, your skin is hard and smooth like ivory but brown and whorled like wood. You are clearly broken, you have no memory of your creation or purpose, and some days your white internal juices ooze thickly from cracks in your skin.",
  "possessions": [
    {
      "name": "Soldering iron"
    },
    {
      "name": "Detachable autonomous hands or centaur body (+4 Run) or inbuilt particle detector (+4 Second Sight) or one random Spell at rank 3",
      "description": "Innate body modification / cybernetic attachment",
      "slots": 0
    }
  ],
  "advancedSkills": [
    {
      "name": "Golden Barge Pilot",
      "rank": 3
    },
    {
      "name": "Astrology",
      "rank": 2
    },
    {
      "name": "Pistolet Fighting",
      "rank": 2
    },
    {
      "name": "Healing",
      "rank": 2
    },
    {
      "name": "Run",
      "rank": 1
    },
    {
      "name": "Strength",
      "rank": 1
    },
    {
      "name": "Cooking",
      "rank": 1
    }
  ],
  "spells": [],
  "special": [
    "You don't recover Stamina by resting in the usual manner \u2014 instead you must spend a full rest period with a hot iron welding your skin back together like putty. For each hour of rest with access to the right tools you regain 3 Stamina.",
    "You may recharge plasmic machines by hooking your fluids to them and spending Stamina at a rate of 1 Stamina and 6 minutes per charge.",
    "You always count as being at least Lightly Armoured."
  ]
}
