{
  "@context": "https://troika-system-json.cheeleong.dev/context.jsonld",
  "@id": "https://troika-system-json.cheeleong.dev/objects/backgrounds/11-ardent-giant-of-corda.json",
  "@type": "Background",
  "id": 11,
  "name": "Ardent Giant of Corda",
  "description": "Every giant has a different story about Corda, well told and interrupted with tears and laughter, of how they lost it and mean to find it soon enough but oh, what of today? We should drink and cheer, we'll search once again in the morning!",
  "possessions": [
    {
      "name": "Artefact of Lost Corda",
      "description": "Being either an enormous Blue Star Map which can tell you where any portal leads (with a successful Astrology test) or a pocket barometer for forecasting the weather (5 in 6 accuracy) or a Ruby Lorgnette granting +2 Second Sight"
    }
  ],
  "advancedSkills": [
    {
      "name": "Strength",
      "rank": 4
    },
    {
      "name": "Astrology",
      "rank": 3
    },
    {
      "name": "Run",
      "rank": 2
    },
    {
      "name": "Climb",
      "rank": 2
    }
  ],
  "spells": [],
  "special": []
}
