{
  "@context": "https://cheeleong.dev/troika-system-json/context.jsonld",
  "@id": "https://cheeleong.dev/troika-system-json/objects/backgrounds/62-vengeful-child.json",
  "@type": "Background",
  "id": 62,
  "name": "Vengeful Child",
  "description": "Your village was burnt down by ruffians, or your mother was beheaded by snake cultists, or your father was hung by corrupt officials. Either way you took umbrage and entered the world with a chip on one shoulder and an oversized Sword on the other.",
  "possessions": [
    {
      "name": "Too-Large Sword that provides +1 to Longsword Fighting and Damage while using it. Only you may benefit from this bonus; it's not magic, just sentimental"
    },
    {
      "name": "Old Hunting Bow and 12 Arrows"
    }
  ],
  "advancedSkills": [
    {
      "name": "Longsword Fighting",
      "rank": 3
    },
    {
      "name": "Awareness",
      "rank": 1
    },
    {
      "name": "Climb",
      "rank": 1
    },
    {
      "name": "Bow Fighting",
      "rank": 1
    },
    {
      "name": "Run",
      "rank": 1
    },
    {
      "name": "Swim",
      "rank": 1
    },
    {
      "name": "Vengeance",
      "rank": 1
    }
  ],
  "spells": [],
  "special": []
}
