{
  "@context": "https://cheeleong.dev/troika-system-json/context.jsonld",
  "@id": "https://cheeleong.dev/troika-system-json/objects/backgrounds/63-venturesome-academic.json",
  "@type": "Background",
  "id": 63,
  "name": "Venturesome Academic",
  "description": "You're a classically trained Academic, a product of the universities of the Brass City, the Palace of Tigers, or some other less prestigious centre of learning among the spheres.",
  "possessions": [
    {
      "name": "Reading Glasses in a sturdy case (you cannot read without them)"
    },
    {
      "name": "Small Sword"
    },
    {
      "name": "Bundle of Candles and Matches"
    },
    {
      "name": "Writing materials"
    },
    {
      "name": "Journal"
    }
  ],
  "advancedSkills": [
    {
      "name": "Evaluate",
      "rank": 2
    },
    {
      "name": "Astrology",
      "rank": 2
    },
    {
      "name": "Healing",
      "rank": 1
    },
    {
      "name": "Sword Fighting",
      "rank": 1
    },
    {
      "name": "Sleight of Hand",
      "rank": 1
    }
  ],
  "spells": [
    {
      "name": "Random",
      "rank": 1
    }
  ],
  "special": [
    "You may Test your Luck to recall facts that you might reasonably be expected to have encountered relating to the natural sciences and humanities."
  ]
}
