{
  "@context": "https://cheeleong.dev/troika-system-json/systems/context.jsonld",
  "@id": "https://cheeleong.dev/troika-system-json/objects/backgrounds/53-college-of-friends.json",
  "@type": "Background",
  "id": 53,
  "name": "Sorcerer of the College of Friends",
  "description": "As an integral part of your tutelage in the sub-dimensional academy of the Cordial Wizard God you spent your childhood learning about the fate of pixies, the colour of magic, ritual grammar, and endless other theoretical topics. Now you're out in the world, discovering that your education hardly accounted for any of the things that you've seen.",
  "possessions": [
    {
      "name": "Pointed Wizard Hat you received at graduation"
    },
    {
      "name": "Wizard Biscuits",
      "quantity": "2d6",
      "description": "Pocket full of wizard biscuits, each counts as a Provision"
    },
    {
      "name": "Wand used to help focus new apprentices, now kept for sentimental reasons"
    }
  ],
  "advancedSkills": [
    {
      "name": "Secret Signs \u2013 Witching Words",
      "rank": 4
    },
    {
      "name": "Run",
      "rank": 2
    },
    {
      "name": "Climb",
      "rank": 1
    },
    {
      "name": "Sleight of Hand",
      "rank": 1
    },
    {
      "name": "Swim",
      "rank": 1
    },
    {
      "name": "Sneak",
      "rank": 1
    },
    {
      "name": "Second Sight",
      "rank": 1
    }
  ],
  "spells": [
    {
      "name": "Jolt",
      "rank": 1
    },
    {
      "name": "Amity",
      "rank": 1
    },
    {
      "name": "Mirror Selves",
      "rank": 1
    },
    {
      "name": "Protection from Rain",
      "rank": 1
    },
    {
      "name": "Helping Hands",
      "rank": 1
    },
    {
      "name": "Purple Lens",
      "rank": 1
    },
    {
      "name": "Random",
      "rank": 1
    }
  ],
  "special": []
}
