{
  "@context": "https://cheeleong.dev/troika-system-json/context.jsonld",
  "@id": "https://cheeleong.dev/troika-system-json/objects/backgrounds/55-temple-knight.json",
  "@type": "Background",
  "id": 55,
  "name": "Temple Knight of Telak the Swordbringer",
  "description": "You were once (and possibly still are) a fanatical monk set to maintain constant, vigilant martial readiness in preparation for the end times, when all doorways crumble inwards. You are always prepared and never unready.",
  "possessions": [
    {
      "name": "The Blessing of Telak"
    },
    {
      "name": "6 Swords of your choice"
    }
  ],
  "advancedSkills": [
    {
      "name": "Awareness",
      "rank": 3
    },
    {
      "name": "Blacksmithing",
      "rank": 2
    },
    {
      "name": "Sword Fighting",
      "rank": 1
    },
    {
      "name": "Greatsword Fighting",
      "rank": 1
    }
  ],
  "spells": [],
  "special": [
    "The blessing of Telak awards you Armour equal to half (rounded down) the number of Swords you carry. If you carried 6 Swords your Armour would be 3 while if you carried 9 it would be 4. You must be overtly armed at all times or else Telak will take this blessing away until you forge and donate to the unarmed a brand new Sword."
  ]
}
